<?xml version="1.0" encoding="UTF-8" standalone="no"?>
<xs:schema elementFormDefault="qualified" targetNamespace="http://earthdawn.com/namegiver" xmlns="http://earthdawn.com/namegiver" xmlns:xs="http://www.w3.org/2001/XMLSchema" xmlns:edt="http://earthdawn.com/datatypes">
	<xs:import namespace="http://earthdawn.com/datatypes" schemaLocation="earthdawndatatypes.xsd"/>
	<xs:simpleType name="namegivermovmenttype_type">
		<xs:restriction base="xs:string">
			<xs:enumeration value="ground"/>
			<xs:enumeration value="flight"/>
		</xs:restriction>
	</xs:simpleType>
	<xs:complexType name="ATTRIBUTENAMEVALUE_type">
		<xs:attribute name="name" type="edt:ATTRIBUTE_name_type" use="required"/>
		<xs:attribute name="value" type="edt:unsigned_int" use="required"/>
	</xs:complexType>
	<xs:complexType name="NAMEGIVERMOVEMENT_type">
		<xs:attribute name="type" type="namegivermovmenttype_type" use="required"/>
		<xs:attribute name="value" type="edt:unsigned_int" use="required"/>
	</xs:complexType>
	<xs:complexType name="NAMEGIVERWEAPONSIZERESTRICTION_type">
		<xs:attribute name="onehandmin" type="edt:unsigned_int" default="1"/>
		<xs:attribute name="onehandmax" type="edt:unsigned_int" default="3"/>
		<xs:attribute name="twohandmin" type="edt:unsigned_int" default="4"/>
		<xs:attribute name="twohandmax" type="edt:unsigned_int" default="6"/>
	</xs:complexType>
	<xs:complexType name="NAMEGIVERABILITY_type">
		<xs:sequence>
			<xs:element maxOccurs="6" minOccurs="6" name="ATTRIBUTE" type="ATTRIBUTENAMEVALUE_type"/>
			<xs:element maxOccurs="1" minOccurs="1" name="ARMOR" type="edt:ARMOR_type"/>
			<xs:element maxOccurs="1" minOccurs="1" name="WOUND" type="edt:WOUND_type"/>
			<xs:element maxOccurs="1" minOccurs="1" name="WEAPONSIZERESTRICTION" type="NAMEGIVERWEAPONSIZERESTRICTION_type"/>
			<xs:element maxOccurs="unbounded" minOccurs="0" name="DEFENSE" type="edt:DEFENSEABILITY_type"/>
			<xs:element maxOccurs="unbounded" minOccurs="0" name="TALENT" type="edt:TALENTABILITY_type"/>
			<xs:element maxOccurs="unbounded" minOccurs="0" name="CARRY" type="edt:TALENTABILITY_type"/>
			<xs:element maxOccurs="unbounded" minOccurs="0" name="ABILITY" type="xs:string"/>
			<xs:element maxOccurs="unbounded" minOccurs="0" name="ORIGIN" type="xs:string"/>
			<xs:element maxOccurs="unbounded" minOccurs="0" name="NOTDEFAULTSKILL" type="xs:string"/>
			<xs:element maxOccurs="unbounded" minOccurs="0" name="DEFAULTLANGUAGE" type="edt:CHARACTERLANGUAGE_type"/>
		</xs:sequence>
		<xs:attribute name="name" type="xs:string" use="required"/>
		<xs:attribute name="karmamodifier" type="edt:unsigned_int" default="0"/>
		<xs:attribute name="movement_ground" type="edt:unsigned_int" default="0"/>
		<xs:attribute name="movement_flight" type="edt:unsigned_int" default="0"/>
		<xs:attribute name="enduringarmorfactor" type="xs:float" default="1.0"/>
		<xs:attribute name="lang" type="edt:language_type" use="required"/>
		<xs:attribute name="type" type="xs:string" default=""/>
	</xs:complexType>
	<xs:element name="NAMEGIVERS">
		<xs:complexType>
			<xs:sequence>
				<xs:element maxOccurs="unbounded" minOccurs="0" name="NAMEGIVER" type="NAMEGIVERABILITY_type"/>
			</xs:sequence>
			<xs:attribute name="rulesetversion" type="edt:rulesetversion_type" default="ED3"/>
		</xs:complexType>
	</xs:element>
</xs:schema>
